{
  "schema": "ace/0.1",
  "context_id": "00000000-0000-4000-8000-000000000001",
  "observed_at": "2026-08-23T06:55:00.000Z",
  "totem_id": 41,
  "site_id": "loja-centro",
  "privacy": {
    "gateway": "ace/0.1",
    "identity_dropped": true,
    "image_dropped": true
  },
  "presence": false,
  "count": 0,
  "group": false,
  "density": "low",
  "motion": {
    "approaching": 0,
    "passing": 0,
    "stopped": 0,
    "leaving": 0
  },
  "attention": "none",
  "dwell_ms": 0,
  "interaction": {
    "touch": false,
    "qr": false,
    "nfc": false
  },
  "clock": {
    "hour_local": 6,
    "day_of_week": 0,
    "store_open": false
  },
  "confidence": 0.99,
  "session_id": "ephemeral-idle-41"
}
