{
  "schema": "ace/0.1",
  "context_id": "d4e5f6a7-b8c9-4012-d345-6789abcdef01",
  "observed_at": "2026-08-23T23:10:00.000Z",
  "totem_id": 41,
  "site_id": "loja-centro",
  "privacy": {
    "gateway": "ace/0.1",
    "identity_dropped": true,
    "image_dropped": true
  },
  "presence": true,
  "count": 1,
  "group": false,
  "density": "low",
  "motion": {
    "approaching": 0,
    "passing": 0,
    "stopped": 1,
    "leaving": 0
  },
  "attention": "low",
  "dwell_ms": 200,
  "interaction": {
    "touch": false,
    "qr": false,
    "nfc": false
  },
  "clock": {
    "hour_local": 23,
    "day_of_week": 0,
    "store_open": false
  },
  "confidence": 0.8,
  "session_id": "ephemeral-closed-41"
}
