{
  "schema": "ace/0.1",
  "context_id": "8f42a1e2-4c1a-4b9e-9d3a-0c7e1b2a9f10",
  "observed_at": "2026-08-23T21:32:11.420Z",
  "totem_id": 41,
  "site_id": "loja-centro",
  "privacy": {
    "gateway": "ace/0.1",
    "identity_dropped": true,
    "image_dropped": true
  },
  "presence": true,
  "count": 3,
  "group": true,
  "density": "medium",
  "motion": {
    "approaching": 2,
    "passing": 0,
    "stopped": 1,
    "leaving": 0
  },
  "attention": "high",
  "dwell_ms": 4200,
  "interaction": {
    "touch": false,
    "qr": false,
    "nfc": false
  },
  "clock": {
    "hour_local": 18,
    "day_of_week": 6,
    "store_open": true
  },
  "confidence": 0.91,
  "session_id": "ephemeral-8f42a1"
}
